{
  "$schema": "../contracts/v1/channel-registry.schema.json",
  "schema": "identity.channel-registry-source/v1",
  "registry": {
    "id": "egohygiene-organization-channels",
    "version": "1.0.0",
    "owner": "Ego Hygiene",
    "reviewedAt": "2026-08-31T00:00:00Z"
  },
  "security": {
    "secretsStored": false,
    "ownerReferenceKind": "role",
    "procedureLocation": "private organization account-recovery runbook"
  },
  "channels": [
    {
      "id": "bluesky",
      "platform": { "id": "bluesky", "label": "Bluesky" },
      "canonicalUrl": null,
      "handle": null,
      "ownershipEntity": "Ego Hygiene",
      "verification": { "state": "unverified", "evidence": null },
      "lifecycle": { "state": "planned", "since": "2026-08-31", "notes": "No canonical organization account has been approved yet." },
      "audiencePurpose": "Ego Hygiene organization news and community discovery.",
      "contentScope": ["organization updates", "project releases", "community resources"],
      "locale": ["en"],
      "accessibility": { "label": "Ego Hygiene on Bluesky", "contactNotes": "Use the canonical website until this channel becomes active." },
      "recoveryOwner": "organization-account-administrator",
      "badge": { "approved": false, "label": "Follow Ego Hygiene on Bluesky", "icon": { "id": "bluesky", "source": "https://simpleicons.org/?q=bluesky", "license": "CC0-1.0" } },
      "governance": { "subject": "channel:bluesky", "state": "approved", "visibility": "public", "provenance": { "method": "human-authored", "source": "https://github.com/egohygiene/identity/issues/65", "capturedAt": "2026-08-31T00:00:00Z" }, "approval": "approve-channel-bluesky" }
    },
    {
      "id": "discord",
      "platform": { "id": "discord", "label": "Discord" },
      "canonicalUrl": null,
      "handle": null,
      "ownershipEntity": "Ego Hygiene",
      "verification": { "state": "unverified", "evidence": null },
      "lifecycle": { "state": "planned", "since": "2026-08-31", "notes": "No canonical organization community has been approved yet." },
      "audiencePurpose": "Real-time community discussion and peer support around Ego Hygiene projects.",
      "contentScope": ["community discussion", "project help", "release announcements"],
      "locale": ["en"],
      "accessibility": { "label": "Ego Hygiene community on Discord", "contactNotes": "Use the canonical website until this channel becomes active." },
      "recoveryOwner": "organization-account-administrator",
      "badge": { "approved": false, "label": "Join Ego Hygiene on Discord", "icon": { "id": "discord", "source": "https://simpleicons.org/?q=discord", "license": "CC0-1.0" } },
      "governance": { "subject": "channel:discord", "state": "approved", "visibility": "public", "provenance": { "method": "human-authored", "source": "https://github.com/egohygiene/identity/issues/65", "capturedAt": "2026-08-31T00:00:00Z" }, "approval": "approve-channel-discord" }
    },
    {
      "id": "instagram",
      "platform": { "id": "instagram", "label": "Instagram" },
      "canonicalUrl": null,
      "handle": null,
      "ownershipEntity": "Ego Hygiene",
      "verification": { "state": "unverified", "evidence": null },
      "lifecycle": { "state": "planned", "since": "2026-08-31", "notes": "No canonical organization account has been approved yet." },
      "audiencePurpose": "Visual storytelling for the Ego Hygiene ecosystem.",
      "contentScope": ["visual identity", "project highlights", "educational media"],
      "locale": ["en"],
      "accessibility": { "label": "Ego Hygiene on Instagram", "contactNotes": "Published media must include meaningful alternative text or captions." },
      "recoveryOwner": "organization-account-administrator",
      "badge": { "approved": false, "label": "Follow Ego Hygiene on Instagram", "icon": { "id": "instagram", "source": "https://simpleicons.org/?q=instagram", "license": "CC0-1.0" } },
      "governance": { "subject": "channel:instagram", "state": "approved", "visibility": "public", "provenance": { "method": "human-authored", "source": "https://github.com/egohygiene/identity/issues/65", "capturedAt": "2026-08-31T00:00:00Z" }, "approval": "approve-channel-instagram" }
    },
    {
      "id": "mastodon",
      "platform": { "id": "mastodon", "label": "Mastodon" },
      "canonicalUrl": null,
      "handle": null,
      "ownershipEntity": "Ego Hygiene",
      "verification": { "state": "unverified", "evidence": null },
      "lifecycle": { "state": "planned", "since": "2026-08-31", "notes": "Instance and canonical organization account have not been selected." },
      "audiencePurpose": "Federated organization news and open-source community participation.",
      "contentScope": ["organization updates", "open-source releases", "community resources"],
      "locale": ["en"],
      "accessibility": { "label": "Ego Hygiene on Mastodon", "contactNotes": "Use the canonical website until this channel becomes active." },
      "recoveryOwner": "organization-account-administrator",
      "badge": { "approved": false, "label": "Follow Ego Hygiene on Mastodon", "icon": { "id": "mastodon", "source": "https://simpleicons.org/?q=mastodon", "license": "CC0-1.0" } },
      "governance": { "subject": "channel:mastodon", "state": "approved", "visibility": "public", "provenance": { "method": "human-authored", "source": "https://github.com/egohygiene/identity/issues/65", "capturedAt": "2026-08-31T00:00:00Z" }, "approval": "approve-channel-mastodon" }
    },
    {
      "id": "open-collective",
      "platform": { "id": "open-collective", "label": "Open Collective" },
      "canonicalUrl": null,
      "handle": null,
      "ownershipEntity": "Ego Hygiene",
      "verification": { "state": "unverified", "evidence": null },
      "lifecycle": { "state": "planned", "since": "2026-08-31", "notes": "No canonical collective or oc.app community channel has been approved yet." },
      "audiencePurpose": "Transparent community funding and contributor coordination.",
      "contentScope": ["funding transparency", "community updates", "contributor support"],
      "locale": ["en"],
      "accessibility": { "label": "Ego Hygiene on Open Collective", "contactNotes": "Use the canonical website until this channel becomes active." },
      "recoveryOwner": "organization-account-administrator",
      "badge": { "approved": false, "label": "Support Ego Hygiene on Open Collective", "icon": { "id": "open-collective", "source": "https://simpleicons.org/?q=opencollective", "license": "CC0-1.0" } },
      "governance": { "subject": "channel:open-collective", "state": "approved", "visibility": "public", "provenance": { "method": "human-authored", "source": "https://github.com/egohygiene/identity/issues/65", "capturedAt": "2026-08-31T00:00:00Z" }, "approval": "approve-channel-open-collective" }
    },
    {
      "id": "pinterest",
      "platform": { "id": "pinterest", "label": "Pinterest" },
      "canonicalUrl": null,
      "handle": null,
      "ownershipEntity": "Ego Hygiene",
      "verification": { "state": "unverified", "evidence": null },
      "lifecycle": { "state": "planned", "since": "2026-08-31", "notes": "No canonical organization account has been approved yet." },
      "audiencePurpose": "Discoverable visual resources, infographics, and creative project collections.",
      "contentScope": ["infographics", "creative resources", "project collections"],
      "locale": ["en"],
      "accessibility": { "label": "Ego Hygiene on Pinterest", "contactNotes": "Published media must include meaningful descriptions." },
      "recoveryOwner": "organization-account-administrator",
      "badge": { "approved": false, "label": "Follow Ego Hygiene on Pinterest", "icon": { "id": "pinterest", "source": "https://simpleicons.org/?q=pinterest", "license": "CC0-1.0" } },
      "governance": { "subject": "channel:pinterest", "state": "approved", "visibility": "public", "provenance": { "method": "human-authored", "source": "https://github.com/egohygiene/identity/issues/65", "capturedAt": "2026-08-31T00:00:00Z" }, "approval": "approve-channel-pinterest" }
    },
    {
      "id": "threads",
      "platform": { "id": "threads", "label": "Threads" },
      "canonicalUrl": null,
      "handle": null,
      "ownershipEntity": "Ego Hygiene",
      "verification": { "state": "unverified", "evidence": null },
      "lifecycle": { "state": "planned", "since": "2026-08-31", "notes": "No canonical organization account has been approved yet." },
      "audiencePurpose": "Short-form Ego Hygiene organization and project updates.",
      "contentScope": ["organization updates", "project releases", "community prompts"],
      "locale": ["en"],
      "accessibility": { "label": "Ego Hygiene on Threads", "contactNotes": "Use the canonical website until this channel becomes active." },
      "recoveryOwner": "organization-account-administrator",
      "badge": { "approved": false, "label": "Follow Ego Hygiene on Threads", "icon": { "id": "threads", "source": "https://simpleicons.org/?q=threads", "license": "CC0-1.0" } },
      "governance": { "subject": "channel:threads", "state": "approved", "visibility": "public", "provenance": { "method": "human-authored", "source": "https://github.com/egohygiene/identity/issues/65", "capturedAt": "2026-08-31T00:00:00Z" }, "approval": "approve-channel-threads" }
    },
    {
      "id": "x",
      "platform": { "id": "x", "label": "X" },
      "canonicalUrl": null,
      "handle": null,
      "ownershipEntity": "Ego Hygiene",
      "verification": { "state": "unverified", "evidence": null },
      "lifecycle": { "state": "planned", "since": "2026-08-31", "notes": "No canonical organization account has been approved yet." },
      "audiencePurpose": "Short-form Ego Hygiene organization and project updates.",
      "contentScope": ["organization updates", "project releases", "community resources"],
      "locale": ["en"],